id,start_time,end_time,title,tags,people,venues,description
12593,"Fri, 03 Apr 2015 15:00:00 +0800","Fri, 03 Apr 2015 16:00:00 +0800",Sci Fi and Horror TV Anthologies,"Horror, Sci-Fi, TV",Damian Magee,North Ballroom (Large ballroom),"Anthologies has brought us on screen some of the classic sci-fi & Horror stories, as this powerpoint presentation take on a journey to Outer Limits, Twilight Zone, The Night Gallery, Out of the Unknown with a Touch of Evil."
12594,"Sun, 05 Apr 2015 10:00:00 +0800","Sun, 05 Apr 2015 11:00:00 +0800","Blood, Bodices and Vincent Price: Looking ar the Horror works of Roger Corman",Film,Damian Magee,North Ballroom (Large ballroom),"This powerpoint presentation takes look at Roger Corman during his fame of sixties, looking at some films he had made from Little Shop of Horrors to X: The Man with the X-ray eyes and his famous teaming sixties teaming with Vincent Price making Poe films classics."
12597,"Sun, 05 Apr 2015 16:00:00 +0800","Sun, 05 Apr 2015 17:00:00 +0800","Doctor Who in Australia: The Blue Box, Downunder","TV, TV","",North Hamersley (Gaming and Others),"50 years of Remembers
1965, the year that Doctor Who arrive in Australia, bring your memories."
12598,"Fri, 03 Apr 2015 20:30:00 +0800","Fri, 03 Apr 2015 21:30:00 +0800",Beauty & the Beast: The Original Werewolf Tale?,Fantasy,Damian Magee,Centre Ballroom (Med Ballroom),"The original Werewolf tale? –This take look the classic tale, and ask the question is it the original werewolf story, if not where does it come from?  Come and join in who knows where the journey will take us."
12599,"Sat, 04 Apr 2015 15:00:00 +0800","Sat, 04 Apr 2015 16:00:00 +0800",King Lizard: 60 years of Godzilla,Film,"Robert Hood, Damian Magee, Robin Pen",North Ballroom (Large ballroom),"This panels takes look at history of King of the Monsters, including adaptions, competitors and variants. With the high profile releases in recent years of Godzilla and Pacific Rim, it seems like the giant monster (or “kaiju”) is back in fashion around the world. What is it about the giant monster that appeals to us so much? What can these movies give audiences that they can’t get from other speculative fiction films?"
12600,"Mon, 06 Apr 2015 10:00:00 +0800","Mon, 06 Apr 2015 11:00:00 +0800",Forgotten TV Animation: the Hidden Gems,TV,Damian Magee,North Ballroom (Large ballroom),"This powerpoint presentation look at beginning of TV Animation has been a staple diet, some has become classics, awhile others have been forgotten; like Crusader Rabbit, Funny Company, King Leonard & his Short Subjects, Here Comes Grump and many others."
12601,"Mon, 06 Apr 2015 14:00:00 +0800","Mon, 06 Apr 2015 15:00:00 +0800","Please Hammer, Don't Hurt 'em: The lesser known Hammer Horror movies.",Film,Damian Magee,North Ballroom (Large ballroom),"This powerpoint presentation take look at other Hammer has made over the years, from Thrillers, Sci-Fi, Comedies, war, drama and of course Horror. From films as She, Phantom of the Opera, The Nanny, The Lost Continent and many others."
12605,"Fri, 03 Apr 2015 17:00:00 +0800","Fri, 03 Apr 2015 18:00:00 +0800",Before the Flood: Anime in Australia before the 90s,Anime / Manga,Damian Magee,Hamersley South (Small Panel Room),
12607,"Fri, 03 Apr 2015 22:00:00 +0800","Sat, 04 Apr 2015 00:00:00 +0800",GWEN Live stream (Up From Down Under with Michael),"JP Review, Podcast / Radio",Michael Cogan,North Hamersley (Gaming and Others),
12608,"Thu, 02 Apr 2015 20:00:00 +0800","Thu, 02 Apr 2015 21:00:00 +0800",Voyager: a Celebration,TV,"Sarah Akers, Michael Cogan",Hamersley South (Small Panel Room),A celebration of the 20th anniversary of the debut of Star Trek: Voyager. Including season reviews and favouite characters.
12609,"Sun, 05 Apr 2015 16:00:00 +0800","Sun, 05 Apr 2015 17:00:00 +0800",Changing Communities with Intent,"Fandom, Guest of Honour Item, Transformative Works","PRK , Sandy Norman, Sarah Parker, John Scalzi",North Ballroom (Large ballroom),"MODERATOR:PRK
Discussion about the ways we have engaged with the communities around us to affect social change."
12610,"Fri, 03 Apr 2015 16:00:00 +0800","Fri, 03 Apr 2015 17:00:00 +0800",The Writer's Interview: John Scalzi and Grant Watson,"Guest of Honour Item, Writing","John Scalzi, Grant Watson",Hamersley South (Small Panel Room),"Interview with our guests from a whole career retrospective: where they came from, what influenced them, what led them to the career they have today."
12611,"Sat, 04 Apr 2015 16:00:00 +0800","Sat, 04 Apr 2015 18:00:00 +0800",House of Cards: Disney Animation from 1995 to 2004,Film,Grant Watson,North Ballroom (Large ballroom),"By 1994 Walt Disney Animation Studios had broken box office records around the world with The Lion King and was coasting high on the success of a string of massive hits. Just 10 years later and the studio was all but closed, with traditional animation falling in the path of CGI and Disney’s once-firmed monopoly shattered by a range of competitors. This presentation tracks the development of Walt Disney animation over that decade and explores how studio interference, accelerated production schedules and some of the strangest creative choices ever made brought a once-great studio to its knees."
12613,"Fri, 03 Apr 2015 14:00:00 +0800","Fri, 03 Apr 2015 15:00:00 +0800",Terrors of the Second Draft,Writing,"Amanda Bridgeman, Donna Maree Hanson, Keith Stevenson",Hamersley South (Small Panel Room),"A lot of aspiring novelists focus so intently on getting their first draft compete that they never pause to consider what comes next: the rewrite. For some it’s a brilliant opportunity, for others an unwanted task filled with reluctance and dread. What is the best way to go about rewriting your fiction once you’ve completed it? What are the best tricks, techniques and tips to take your work from good to brilliant? What are the traps and pitfalls to avoid? A panel of professional writers discuss their own creative process in refining their works for publication."
12616,"Thu, 02 Apr 2015 21:00:00 +0800","Thu, 02 Apr 2015 22:00:00 +0800",Land of the Setting Sun: The End of Anime?,Anime / Manga,Andy Hahn,Hamersley South (Small Panel Room),"Japan’s once-thriving animation industry is undergoing an unprecedented decline. Studios are closing, the number of anime films in cinemas is falling, audiences in general are moving onto other things, and reliable stalwarts of the medium such as Hayao Miyazaki and Isao Takahata have announced their retirement. What does the future hold for anime? Who are the new directors worth watching? What are the current trends in genre and visual aesthetics? What will anime – and anime fandom – look like in five years’ time? Is it possible that we are seeing the end, for all intents and purposes, of Japanese animation?"
12620,"Fri, 03 Apr 2015 21:30:00 +0800","Fri, 03 Apr 2015 22:30:00 +0800",The Batman Problem: The Dark Nut Returns,"Comics, Film","Devin Jeyathurai, John Parker",Centre Ballroom (Med Ballroom),"All things considered, Batman is probably the most popular superhero of all time. He recently celebrated his 75th birthday, he stars in numerous comic books each month, and for decades he’s been adapted for animation, television, videogames and film. The problem is: should we like him at all? He’s presented as a masked crime fighter saving the lives of countless Gothamites, but when you think about it he’s also a mentally unhinged billionaire who dresses in fetish outfits every night and assaults the mentally unwell. Come take a look at Batman and his fictional universe from a fresher perspective: you may not like what you see."
12622,"Fri, 03 Apr 2015 12:00:00 +0800","Fri, 03 Apr 2015 13:00:00 +0800",The Big Finish: Full cast radio plays make a comeback.,"Family, Podcast / Radio","Aaron Creaser, Isobel White",Hamersley South (Small Panel Room),
12679,"Fri, 03 Apr 2015 15:00:00 +0800","Fri, 03 Apr 2015 16:00:00 +0800",The Writer's Interview: Kylie Chan,Guest of Honour Item,"Kylie Chan, Helen Stubbs",Centre Ballroom (Med Ballroom),"Interview with our guests from a whole career retrospective: where they came from, what influenced them, what led them to the career they have today."
12680,"Sat, 04 Apr 2015 10:30:00 +0800","Sat, 04 Apr 2015 11:00:00 +0800","Launch - Tehani Wessely - ""Insert Title Here""","Launch, Launch",Tehani Wessely,Hamersley South (Small Panel Room),"Launch of book ""Insert Title Here"""
12681,"Sun, 05 Apr 2015 17:00:00 +0800","Sun, 05 Apr 2015 18:00:00 +0800",Trailer Park - Asian Cinema,Film,"Candice Schilder, Grant Watson",North Ballroom (Large ballroom),Asian Cinema Trailer Park
12682,"Fri, 03 Apr 2015 21:30:00 +0800","Fri, 03 Apr 2015 22:30:00 +0800",Scared S#!%less: How Horror Movies Work,Film,"Sonia Marcon, Grant Watson",North Ballroom (Large ballroom),"Scared S#!%less: How Horror Movies Work
Many enjoy a good horror movie, but few consider how they actually work. Why are we drawn to things that frighten or startle us? Learn the techniques used by horror directors from America, Europe and Asia to see why precisely horror cinema frightens us - and why we enjoy it."
12683,"Sun, 05 Apr 2015 21:30:00 +0800","Sun, 05 Apr 2015 22:30:00 +0800",(Over-used) Fan-Fiction Tropes,Transformative Works,"Belinda Forbes, Desiree Heald, Leonie Rodgers",Hamersley South (Small Panel Room),"Fan-fiction likes to have a lot of tags when put out for public consumption. Within Fan-fiction, fans can play around with some of the tropes and ideas presented in their source material. What is it about Fan-fiction tropes that catch and hold us? Do we over use the tropes that we have? Do we need more, or less? May contain references to Grimm, Arrow, Flash and Teen Wolf."
12684,"Sun, 05 Apr 2015 10:00:00 +0800","Sun, 05 Apr 2015 11:00:00 +0800",Lucy M Boston – An Appreciation,Books,Emma Hawkes,Centre Ballroom (Med Ballroom),"An appreciation of Lucy M Boston, the author of the Green Knowe fantasy series."
12685,"Sun, 05 Apr 2015 19:30:00 +0800","Sun, 05 Apr 2015 20:30:00 +0800",Is the Best of Comics Found in Non-Canon Works?,Comics,"Travis Johnson, Grant Watson, Sabian Wilde",Centre Ballroom (Med Ballroom),A critical exploration of whether the best work in mainstream comics within the last <timeframe> can actually be found in non-canon works such as <name drop>
12687,"Thu, 02 Apr 2015 19:00:00 +0800","Thu, 02 Apr 2015 19:30:00 +0800",Meet the Swancon A/V guy,Conrunning,Andy Hahn,Hamersley South (Small Panel Room),"Attention Swancon panelist, this session has been allotted for you to come and check out the standard A/V setup of your panel room. Should you require to test your devices, now is the time! Your friendly A/V Guy, Andy Hahn, will be available to chat to if you have any questions or requests."
12688,"Sun, 05 Apr 2015 15:00:00 +0800","Sun, 05 Apr 2015 16:00:00 +0800",The History of Studio Ghibli - Conclusion,Anime / Manga,Andy Hahn,Centre Ballroom (Med Ballroom),Last year we discussed from 'Nausicaa: Valley of the Wind' all the way up to 'My Neighbors the Yamadas'. This year come to hear interest fact and tidbits about the well known 'Spirited Away' all the way up to the recent release 'When Marnie Was There' as well as the direction the studio is going now!
12689,"Sat, 04 Apr 2015 16:30:00 +0800","Sat, 04 Apr 2015 18:00:00 +0800",Kids Masquerade,Family,Emma Hawkes,Family Room (Boardroom),
12690,"Sun, 05 Apr 2015 17:00:00 +0800","Sun, 05 Apr 2015 18:00:00 +0800",Plush Toy Wars,Family,Adam McCaw,Family Room (Boardroom),
12691,"Mon, 06 Apr 2015 16:30:00 +0800","Mon, 06 Apr 2015 18:00:00 +0800",Pack Up,Prep,"",Family Room (Boardroom),
12692,"Thu, 02 Apr 2015 12:30:00 +0800","Thu, 02 Apr 2015 14:30:00 +0800",Set-Up,Prep,"",Family Room (Boardroom),
12693,"Thu, 02 Apr 2015 14:30:00 +0800","Thu, 02 Apr 2015 18:30:00 +0800",Sign-In and Registration,Prep,"",Family Room (Boardroom),
12694,"Sun, 05 Apr 2015 09:30:00 +0800","Sun, 05 Apr 2015 11:00:00 +0800",General Crafting,Family,"",Family Room (Boardroom),
12695,"Sat, 04 Apr 2015 09:30:00 +0800","Sat, 04 Apr 2015 11:00:00 +0800",Saturday Morning Cartoons,TV,"",Family Room (Boardroom),"Who doesn't love a lazy Saturday morning with some good, old fashioned cartoons? A relaxing time to have some TV fun. 

Shows include:
  * Ruby Gloom
  * Jem and the Holograms
  * My Little Pony
  * The Powerpuff Girls"
12696,"Fri, 03 Apr 2015 09:30:00 +0800","Fri, 03 Apr 2015 11:00:00 +0800",Creche Rhymes,Family,"",Family Room (Boardroom),"Your favourite nursery rhymes, with a twist. Come and sing some of the geekiest versions of kids songs ever, and maybe even write some yourself!

Lyrics for the current batch of Creche Rhymes can be found here:"
12697,"Mon, 06 Apr 2015 09:30:00 +0800","Mon, 06 Apr 2015 11:00:00 +0800",General Crafting,Family,"",Family Room (Boardroom),
12698,"Fri, 03 Apr 2015 11:00:00 +0800","Fri, 03 Apr 2015 11:30:00 +0800",Horrible Histories - mini panel,Family,"",Family Room (Boardroom),
12699,"Sat, 04 Apr 2015 11:00:00 +0800","Sat, 04 Apr 2015 11:30:00 +0800",My Little Pony - Colouring In And Discussion,Family,Adam McCaw,Family Room (Boardroom),
12700,"Sun, 05 Apr 2015 11:00:00 +0800","Sun, 05 Apr 2015 11:30:00 +0800",Circuits: A How-To Guide - mini panel,"Family, Science and Tech","",Family Room (Boardroom),
12701,"Mon, 06 Apr 2015 11:00:00 +0800","Mon, 06 Apr 2015 11:30:00 +0800",How To Stump A Scientist - mini panel,"Family, Science and Tech","",Family Room (Boardroom),
12702,"Fri, 03 Apr 2015 14:30:00 +0800","Fri, 03 Apr 2015 15:00:00 +0800",The Basics of Drawing,Family,"",Family Room (Boardroom),
12703,"Fri, 03 Apr 2015 11:30:00 +0800","Fri, 03 Apr 2015 12:00:00 +0800",Pocky Ker-Plunk,Family,"",Family Room (Boardroom),
12704,"Fri, 03 Apr 2015 12:00:00 +0800","Fri, 03 Apr 2015 13:00:00 +0800",Juggling: A How-To Guide,Family,Kitty Byrne,Family Room (Boardroom),Juggling is a great way to exercise your hand-eye coordination and improve your reaction times. And it's fun! Come and learn to juggle with someone who taught herself with YouTube videos. All ages welcome! Suitable for anyone who can throw and catch :)
12705,"Fri, 03 Apr 2015 14:00:00 +0800","Fri, 03 Apr 2015 14:30:00 +0800",Quiet Reading,Family,"",Family Room (Boardroom),
12706,"Fri, 03 Apr 2015 15:00:00 +0800","Fri, 03 Apr 2015 15:30:00 +0800",Reading 1,Family,"",Family Room (Boardroom),
12707,"Fri, 03 Apr 2015 15:30:00 +0800","Fri, 03 Apr 2015 16:30:00 +0800",Make-Your-Own Instruments,Family,"",Family Room (Boardroom),
12708,"Sat, 04 Apr 2015 14:30:00 +0800","Sat, 04 Apr 2015 15:00:00 +0800",The Basics of Sewing,Family,"Katherine McFarlane, Sarah McFarlane",Family Room (Boardroom),
12709,"Sat, 04 Apr 2015 11:30:00 +0800","Sat, 04 Apr 2015 12:00:00 +0800",Cookie Decorating,Family,"",Family Room (Boardroom),
12710,"Sat, 04 Apr 2015 12:00:00 +0800","Sat, 04 Apr 2015 13:00:00 +0800",Children's LARP,Family,"",Family Room (Boardroom),
12711,"Sat, 04 Apr 2015 14:00:00 +0800","Sat, 04 Apr 2015 14:30:00 +0800",Quiet Reading,Family,"",Family Room (Boardroom),
12713,"Sat, 04 Apr 2015 15:00:00 +0800","Sat, 04 Apr 2015 15:30:00 +0800",Reading 2,Family,"",Family Room (Boardroom),
12714,"Sat, 04 Apr 2015 15:30:00 +0800","Sat, 04 Apr 2015 16:30:00 +0800",Costume Crafting for Kids,Family,"",Family Room (Boardroom),
12715,"Sun, 05 Apr 2015 11:30:00 +0800","Sun, 05 Apr 2015 12:00:00 +0800",Egg-Bot and Easter Egg Decorating,Family,Kitty Byrne,Family Room (Boardroom),
12716,"Sun, 05 Apr 2015 12:00:00 +0800","Sun, 05 Apr 2015 13:00:00 +0800",Easter Egg Hunt,Family,"",Family Room (Boardroom),
12717,"Sun, 05 Apr 2015 14:00:00 +0800","Sun, 05 Apr 2015 14:30:00 +0800",Quiet Reading,Family,"",Family Room (Boardroom),
12718,"Sun, 05 Apr 2015 14:30:00 +0800","Sun, 05 Apr 2015 15:00:00 +0800",Build Your Own SPACESHIP!,Family,"",Family Room (Boardroom),
12719,"Sun, 05 Apr 2015 15:00:00 +0800","Sun, 05 Apr 2015 15:30:00 +0800",Reading 3,Family,"",Family Room (Boardroom),
12720,"Sun, 05 Apr 2015 15:30:00 +0800","Sun, 05 Apr 2015 16:00:00 +0800",Guardian Princess Alliance - mini panel,Family,Emma Hawkes,Family Room (Boardroom),"Ready for a Princess with a difference? An appreciation of the new series of books about multi-cultural Princesses who act together to save the planet. 

http://guardianprincesses.com/"
12721,"Sun, 05 Apr 2015 16:00:00 +0800","Sun, 05 Apr 2015 16:30:00 +0800",Make Your Own Game,Family,"",Family Room (Boardroom),
12722,"Sun, 05 Apr 2015 16:30:00 +0800","Sun, 05 Apr 2015 17:00:00 +0800",Free Time - Play Your Games,Family,"",Family Room (Boardroom),
12723,"Mon, 06 Apr 2015 11:30:00 +0800","Mon, 06 Apr 2015 12:00:00 +0800",KitKat Jenga,Family,"",Family Room (Boardroom),
12724,"Mon, 06 Apr 2015 12:00:00 +0800","Mon, 06 Apr 2015 13:00:00 +0800",Live Action Quiddich,Family,"",Family Room (Boardroom),
12725,"Mon, 06 Apr 2015 14:00:00 +0800","Mon, 06 Apr 2015 14:30:00 +0800",Quiet Reading,Family,"",Family Room (Boardroom),
12726,"Mon, 06 Apr 2015 14:30:00 +0800","Mon, 06 Apr 2015 15:00:00 +0800",How To Origami,Family,"",Family Room (Boardroom),
12727,"Mon, 06 Apr 2015 15:00:00 +0800","Mon, 06 Apr 2015 15:30:00 +0800",Reading 4,Family,"",Family Room (Boardroom),
12728,"Mon, 06 Apr 2015 15:30:00 +0800","Mon, 06 Apr 2015 16:00:00 +0800",Minecraft - Mini Panel,Family,"",Family Room (Boardroom),
12729,"Mon, 06 Apr 2015 16:00:00 +0800","Mon, 06 Apr 2015 16:30:00 +0800",Design Your Own Superhero,Family,"",Family Room (Boardroom),
12730,"Thu, 02 Apr 2015 18:30:00 +0800","Thu, 02 Apr 2015 19:00:00 +0800",Opening Ceremony 2015,Event,"Kylie Chan, Stephen Griffiths, John Parker, Sarah Parker, Anthony Peacey, John Scalzi","","Opening ceremony, bells, whistles and stuff oh my!"
12732,"Sat, 04 Apr 2015 12:00:00 +0800","Sat, 04 Apr 2015 13:00:00 +0800",John Scalzi - Signing,Guest of Honour Item,John Scalzi,North Ballroom (Large ballroom),
12733,"Thu, 02 Apr 2015 16:00:00 +0800","Thu, 02 Apr 2015 18:30:00 +0800",Setup - Video Game Room,"Prep, Video Games",Adam McCaw,Pilbara (Video Game Stream),
12734,"Fri, 03 Apr 2015 09:00:00 +0800","Fri, 03 Apr 2015 10:00:00 +0800",Open Console Gaming,Video Games,Adam McCaw,Pilbara (Video Game Stream),"Come play some consoles! Try new games, play with friends or catch up on a game you haven't finished yet."
12735,"Fri, 03 Apr 2015 10:00:00 +0800","Fri, 03 Apr 2015 13:00:00 +0800",Hyrule Warriors,Video Games,Adam McCaw,Pilbara (Video Game Stream),Play as characters from the Legend of Zelda games. Fight against endless hordes of foes and special bosses to reclaim Hyrule from an evil dark power. This game is variant on the Dynasty warriors games
12736,"Fri, 03 Apr 2015 14:00:00 +0800","Fri, 03 Apr 2015 15:30:00 +0800",Mario Kart WiiU,Video Games,Adam McCaw,Pilbara (Video Game Stream),Play as iconic Nintendo characters racing to win trohpies and gain fame. Race across a variety of courses from various Nintendo franchises. This will be run as a tournament.
12737,"Fri, 03 Apr 2015 15:30:00 +0800","Fri, 03 Apr 2015 18:00:00 +0800",Super Smash Bros WiiU/3DS,Video Games,Adam McCaw,Pilbara (Video Game Stream),Play as various Nintendo characters from all sorts of Nintendo games. Watch them beat each other up in a frantic fighting game for up to 8 players at the same time! This will be run as a tournament.
12738,"Thu, 02 Apr 2015 19:00:00 +0800","Thu, 02 Apr 2015 22:00:00 +0800",Open Console Gaming,Video Games,Adam McCaw,Pilbara (Video Game Stream),"Come play some consoles! Try new games, play with friends or catch up on a game you haven't finished yet."
12739,"Sat, 04 Apr 2015 09:00:00 +0800","Sat, 04 Apr 2015 10:00:00 +0800",Open Console Gaming,Video Games,Adam McCaw,Pilbara (Video Game Stream),"Come play some consoles! Try new games, play with friends or catch up on a game you haven't finished yet."
12740,"Sun, 05 Apr 2015 09:00:00 +0800","Sun, 05 Apr 2015 10:00:00 +0800",Open Console Gaming,Video Games,Adam McCaw,Pilbara (Video Game Stream),"Come play some consoles! Try new games, play with friends or catch up on a game you haven't finished yet."
12741,"Mon, 06 Apr 2015 09:00:00 +0800","Mon, 06 Apr 2015 13:00:00 +0800",Open Console Gaming,Video Games,Adam McCaw,Pilbara (Video Game Stream),"Come play some consoles! Try new games, play with friends or catch up on a game you haven't finished yet."
12744,"Fri, 03 Apr 2015 19:30:00 +0800","Fri, 03 Apr 2015 23:00:00 +0800",Halo 4,Video Games,Adam McCaw,Pilbara (Video Game Stream),"Come enlist as a Spartan in the UNSC! Compete against other Spartans for glory and points to be the beat...and once you've survived that, we'll throw you into a bunch of crazy alternative games such as Demolition Derby, Run to survive, Super Happy Fun Land and Left 4 Dead! This will be run as a tournament."
12745,"Sat, 04 Apr 2015 10:00:00 +0800","Sat, 04 Apr 2015 13:00:00 +0800",Blur,Video Games,Adam McCaw,Pilbara (Video Game Stream),Do you like cars? Do you like Mario kart? Why not combine real cars with the mechanics of Mario kart?! Well here it is! Blur is a racing game with items and power ups where you blow each other up while trying to reach the finish line.
12746,"Sat, 04 Apr 2015 14:00:00 +0800","Sat, 04 Apr 2015 15:30:00 +0800",DS Fun-o-rama,Video Games,Adam McCaw,Pilbara (Video Game Stream),"Bring your DS, 3DS or 2DS for some group gaming fun with other hand held console gaming players. We'll be playing Mario kart DS or 7, Pokemon, etc. Chargers will be available if you're low on battery!"
12747,"Sat, 04 Apr 2015 15:30:00 +0800","Sat, 04 Apr 2015 17:00:00 +0800",Soul Caliber 4 & 5,Video Games,Adam McCaw,Pilbara (Video Game Stream),"People beating each other up with swords, guns...a giant hammer...that squeeks...yep! Soul Calibur in a nutshell and we'll be playing the 4th and 5th generation of the game. This will be run as a tournament."
12748,"Sat, 04 Apr 2015 17:00:00 +0800","Sat, 04 Apr 2015 18:00:00 +0800",Scott Pilgrim VS The World The Game Co-op Bananza!,Video Games,Adam McCaw,Pilbara (Video Game Stream),Like Scott Pilgram vs the world? Now you can play as characters from the series and go through the story with 3 friends! The game is made as a 16 bit graphic game in the art style of the comics!
12750,"Sun, 05 Apr 2015 10:00:00 +0800","Sun, 05 Apr 2015 13:00:00 +0800",Retro Gaming! ,Video Games,Adam McCaw,Pilbara (Video Game Stream),"Miss the old days of console gaming? Well now you can come relive the era of the old classics because all the consoles will be changed over for Retro ones! Come play on the Super Nintendo, N64, Play station 1, Sega mega drive and other old school gaming platforms!"
12751,"Sat, 04 Apr 2015 19:30:00 +0800","Sat, 04 Apr 2015 23:30:00 +0800",Left 4 Dead 1 and 2 - Survival Endurance Marathon,Video Games,Adam McCaw,Pilbara (Video Game Stream),Play as a surviver of the zombie apocolypse with 3 friends trying to reach a safe haven. Your goal is to play through every stage and survive it all! We'll be nice to you...I promise...
12752,"Sun, 05 Apr 2015 19:30:00 +0800","Sun, 05 Apr 2015 23:00:00 +0800",Griff Ball,Video Games,Adam McCaw,Pilbara (Video Game Stream),"The great sport of taking a land mine, running to the goal and then blowing your self up! Doesn't get much better than that! Play in teams of 4 against other teams of 4 and become the best team ever! Making up of funny team names is manditory and this game will be run as a tournament!"
12753,"Mon, 06 Apr 2015 13:00:00 +0800","Mon, 06 Apr 2015 16:00:00 +0800",Pack Up,Video Games,Adam McCaw,Pilbara (Video Game Stream),
12754,"Fri, 03 Apr 2015 12:00:00 +0800","Fri, 03 Apr 2015 13:00:00 +0800",GoH Kylie Chan Signing,Guest of Honour Item,Kylie Chan,North Ballroom (Large ballroom),
12756,"Sun, 05 Apr 2015 16:00:00 +0800","Sun, 05 Apr 2015 16:30:00 +0800",Fundraising Auction - Setup,Prep,"",South Ballroom (Traders and Art Show Room),Fundraising Auction
12759,"Sun, 05 Apr 2015 19:30:00 +0800","Sun, 05 Apr 2015 20:00:00 +0800",Awards Setup and Prep,Prep,"",North Ballroom (Large ballroom),
12761,"Sun, 05 Apr 2015 15:30:00 +0800","Sun, 05 Apr 2015 18:00:00 +0800",Spyro Co-op!,Video Games,Adam McCaw,Pilbara (Video Game Stream),Play as Spyro and Cynder on their adventures to save the kingdom of dragons! Can you save the world?
12762,"Sun, 05 Apr 2015 14:00:00 +0800","Sun, 05 Apr 2015 15:30:00 +0800",Portal 2 Co-op,Video Games,Adam McCaw,Pilbara (Video Game Stream),Play as two robots trying to survive the testing set by GLaDOS at Aperture science! Can you and a friend survive the tests?!
12764,"Thu, 02 Apr 2015 21:00:00 +0800","Thu, 02 Apr 2015 22:30:00 +0800",Under Construction - Convention Theme,Conrunning,PRK ,North Hamersley (Gaming and Others),"A convention is a fantastic way to steer an overall conversation about the genre. What do you want your convention to *say*? What is its theme? How can you want to use your convention, guests and programme to question or redirect how we interact with speculative fiction?"
12765,"Sat, 04 Apr 2015 21:30:00 +0800","Sat, 04 Apr 2015 23:00:00 +0800",Under Construction - Marketing,Conrunning,"PRK , Matt Holmes, Samara Morgan",North Hamersley (Gaming and Others),"With steadily rising costs for function space, accommodation and airfare, conventions need to either attract and retain new members, steadily raise membership prices, or reduce the size / length of the convention. This session examines how conventions can best market to potential new members with limited budgets?"
12766,"Fri, 03 Apr 2015 20:30:00 +0800","Fri, 03 Apr 2015 22:00:00 +0800",Under Construction - Finding and Keeping Committee,Conrunning,"PRK , Chris Coman",North Hamersley (Gaming and Others),"It takes a great committee to put on a great convention, but what does it take to assemble a great committee? Once you've assembled a great committee, how do you keep everyone on track and prevent committee members from burning out?"
