id,start_time,end_time,title,tags,people,venues,description
12767,"Sun, 05 Apr 2015 17:00:00 +0800","Sun, 05 Apr 2015 18:00:00 +0800",Introduction to Worldcon,Fandom,"PRK , Dave Cake, Sarah Parker",Hamersley South (Small Panel Room),"What's a Worldcon? Why would you want to go or how can you be part of it without leaving your lounge room? This panel explores the various aspects of a World Science Fiction Convention, upcoming conventions and bids, and also covers volunteering. We can't guarantee there won't be any scurrilous stories though. G rated scurrilous stories of course."
12768,"Fri, 03 Apr 2015 17:00:00 +0800","Fri, 03 Apr 2015 19:30:00 +0800",40th Birthday Party,Event,PRK ,North Ballroom (Large ballroom),Catered 40th Birthday Party for Swancon
12769,"Mon, 06 Apr 2015 15:00:00 +0800","Mon, 06 Apr 2015 16:00:00 +0800",Swancon Feedback Panel,Conrunning,"PRK , Stephen Griffiths, Sarah Parker, Frames White, Isobel White",South Ballroom (Traders and Art Show Room),"Hints, suggestions or problems about this convention you would like fixed for next year? The con committees for 2015 and 2016 will be represented to listen to your bouquets and brickbats."
12770,"Fri, 03 Apr 2015 10:00:00 +0800","Fri, 03 Apr 2015 18:00:00 +0800",Traders and Art Show,Event,"",South Ballroom (Traders and Art Show Room),
12771,"Sat, 04 Apr 2015 10:00:00 +0800","Sat, 04 Apr 2015 18:00:00 +0800",Traders and Art Show,Event,"",South Ballroom (Traders and Art Show Room),
12772,"Sun, 05 Apr 2015 09:00:00 +0800","Sun, 05 Apr 2015 12:00:00 +0800",Swap Meet (And Artshow),Event,Sarah McFarlane,South Ballroom (Traders and Art Show Room),
12773,"Sun, 05 Apr 2015 12:00:00 +0800","Sun, 05 Apr 2015 13:00:00 +0800",Swapmeet Breakdown,Prep,"",South Ballroom (Traders and Art Show Room),
12775,"Sun, 05 Apr 2015 16:30:00 +0800","Sun, 05 Apr 2015 18:30:00 +0800",Fundraising Auction (And Art Show),Event,"Chris Coman, Matt Lindus",South Ballroom (Traders and Art Show Room),
12776,"Sun, 05 Apr 2015 16:00:00 +0800","Sun, 05 Apr 2015 17:00:00 +0800",2014 Movie Screenings: A Recap,"Fandom, Film","Stephen Griffiths, Samara Morgan",Hamersley South (Small Panel Room),"2014 Movie Screenings: A Recap
Lets discuss the movies that SwanCon screened last year and the movies that we chose not to. Will also include the trailers or snippets from the movies so we can all decide if the movie lived up to the expectation."
12777,"Sat, 04 Apr 2015 15:00:00 +0800","Sat, 04 Apr 2015 16:00:00 +0800",WA Writers' Panel,Writing,"Stephen Dedman, Stephanie Gunn, Martin Livings, Louisa Loder, Juliet Marillier, Anthony Panegyres",North Hamersley (Gaming and Others),Who's writing in Perth? Come along and talk to some of the people active in Perth's writing scene. Did you know there's heaps of writing groups in WA?
12778,"Sat, 04 Apr 2015 14:00:00 +0800","Sat, 04 Apr 2015 14:30:00 +0800","Launch - Leonie Rogers - ""Frontier Resistance""","Fantasy, Fantasy, Launch, Sci-Fi, Writing","Andrew Harvey, Leonie Rodgers",North Hamersley (Gaming and Others),"Come and celebrate the launch of Book Two of the Frontier series from Leonie Rogers and Hague Publishing! Promising more excitement, explosions and starcats, Rogers brings the next installment in Shanna's story."
12779,"Sat, 04 Apr 2015 19:30:00 +0800","Sat, 04 Apr 2015 20:00:00 +0800",Masquerade Prep,Prep,Jade Rolfe,North Ballroom (Large ballroom),
12780,"Sat, 04 Apr 2015 10:00:00 +0800","Sat, 04 Apr 2015 11:00:00 +0800",Introduction to Modern Board games - what is all the fuss about?,"Gaming, X For Beginners","Ellora Ker, Rob Masters, Leece Smith",North Hamersley (Gaming and Others),Introduction to Modern Board games - what is all the fuss about?
12781,"Mon, 06 Apr 2015 10:00:00 +0800","Mon, 06 Apr 2015 11:00:00 +0800",The Science of Board Game Design,"Gaming, Writing","Steve Gunnell, Roland Kerr, Rob Masters, Anthony Sweet",North Hamersley (Gaming and Others),"Games aren't kid's stuff, even though kids and adults alike enjoy them. Serious number theory  and an understanding of social dynamics go into some of the most powerful games. Join some designers and enthusiasts as they take you for a journey into the nuts and bolts of game design - and discuss why it's needed, and whether there is an issue with the numbers taking over to the detriment of game play."
12784,"Mon, 06 Apr 2015 15:00:00 +0800","Mon, 06 Apr 2015 16:00:00 +0800",Australian Game Design and History,Gaming,"Steve Gunnell, Roland Kerr, Rob Masters, Leece Smith, Anthony Sweet",North Hamersley (Gaming and Others),"A look at the past, present and future of the history of board games in Australia. You will be surprised at the breadth, depth and scope, not to mention ingenuity of Australian designers past and present."
12785,"Fri, 03 Apr 2015 14:00:00 +0800","Fri, 03 Apr 2015 15:00:00 +0800",How to be a good GM (Pt 1 of 2),Gaming,"Daniel Drhoz, Rob Masters, Leece Smith",North Hamersley (Gaming and Others),Are you a GM? (Games Master/Dungeon Master/Storyteller etc) Do you get frustrated by your players? Or are there players you would pay to have in your group? Join us for this panel on what makes a good RPG player and share your tricks and tips.
12786,"Fri, 03 Apr 2015 16:00:00 +0800","Fri, 03 Apr 2015 17:00:00 +0800",How to be a good RPGer (Pt 2 of 2) ,Gaming,"Daniel Drhoz, Rob Masters, Leece Smith",North Hamersley (Gaming and Others),Are you a RPGer? Do you get frustrated by your GMs? Or is there a GM that you would pay to have run your group? Join us for this panel on what makes a good GM and share your tricks and tips.
12787,"Sun, 05 Apr 2015 14:00:00 +0800","Sun, 05 Apr 2015 15:00:00 +0800",Retro Games with Andy,Gaming,Andrea Hatch,North Hamersley (Gaming and Others),
12788,"Mon, 06 Apr 2015 14:00:00 +0800","Mon, 06 Apr 2015 15:00:00 +0800",Nerf Games 2015,Family,Kaneda Cruz,South Ballroom (Traders and Art Show Room),"Rebel Empire Workshop NERF Games 2015
Come and join in some NERF Gun fun with the REW Imperium! A room will be transformed into a rubber foam NERF range with one purpose, shoot the targets the fastest with an array of NERF guns! Whether you are new to NERF guns or not, it will be guaranteed to be full of laughter and excitement.
There will be a gold coin donation before entry to this event. For those willing to participate, there will be  NERF prizes and to be won for each game!"
12789,"Mon, 06 Apr 2015 10:00:00 +0800","Mon, 06 Apr 2015 13:00:00 +0800",Live Action Robo Rally,Gaming,"Bronwyn McDougall, Tim McDougall",South Ballroom (Traders and Art Show Room),"Life Sized Robo Rally! Come along and either program your friends into terrible situations or alternatively, be the robotic plaything of a deranged computer, as represented by your friends."
12791,"Sun, 05 Apr 2015 14:00:00 +0800","Sun, 05 Apr 2015 16:00:00 +0800",Rebel Empire Workshops Performance,Launch,Kaneda Cruz,South Ballroom (Traders and Art Show Room),"Rebel Empire Workshops - a Perth based stage and film production studio, invites Swancon attendees to experience their combination of live action and film performance.
From its origins as a fan based community, Rebel Empire Workshops has grown into a professional fight and stunt choreography company, specialising in live action and cinematic media. 
Drawing its members and inspiration from the general public, Rebel Empire offers the potential to teach anyone any and all aspects of stage and film production, from conceptual development and visual effects to fight choreography and stunt work, encouraging all its members to peruse their passions and to create something bigger than themselves.
Rebel Empire Workshops is on its 7th year and many things have grown in that time. From new Members to new Characters to Costumes, Props and of course Fight Choreography. So come and watch as the R.E.W. Cast and Crew put on a performance of fun and entertainment for all fans; young and old. Immediately following the performance there will be a chance to meet some of the cast and crew, including a brief Q&A session."
12792,"Sat, 04 Apr 2015 10:00:00 +0800","Sat, 04 Apr 2015 10:30:00 +0800",Launch - Deborah Kalin - Cherry Crow Children,Writing,Alisa Krasnostein,Hamersley South (Small Panel Room),"We launched the first 2 volumes of the Twelve Planets - Nightsiders and Love and Romanpunk at Swancon 36. At Swancon 40 in April, we will release the twelfth volume in this collection – Chery Crow Children by Deborah Kalin.
4 years in the making, 12 volumes of (mostly) 4 short stories, each by some of Australia’s finest short story writers, many now award winning.

Expect cake. Expect sheer joy at delivering this awesome ride of a project. Expect New Projects."
12793,"Fri, 03 Apr 2015 10:30:00 +0800","Fri, 03 Apr 2015 10:45:00 +0800",FF - Bees,"15 Minutes, Science and Tech",Daniel Drhoz,North Hamersley (Gaming and Others),
12794,"Thu, 02 Apr 2015 19:00:00 +0800","Thu, 02 Apr 2015 20:00:00 +0800",Depiction of Religion in Science Fiction and Fantasy,"Fantasy, JP Review, Sci-Fi, Transformative Works",Jonathan Durnford,North Ballroom (Large ballroom),Not provided yet
12795,"Fri, 03 Apr 2015 19:30:00 +0800","Fri, 03 Apr 2015 19:45:00 +0800",FF  - Agent Carter,"15 Minutes, TV",Desiree Heald,North Hamersley (Gaming and Others),Agent Carter - by Desiree
12796,"Sat, 04 Apr 2015 14:00:00 +0800","Sat, 04 Apr 2015 14:15:00 +0800",FF - Orphan Black,"15 Minutes, TV","Alisa Krasnostein, Alex Pierce",Centre Ballroom (Med Ballroom),Orphan Black by Alisa and Alex
12797,"Sun, 05 Apr 2015 14:45:00 +0800","Sun, 05 Apr 2015 15:00:00 +0800",FF - True Detective,"15 Minutes, TV",Dave Cake,Centre Ballroom (Med Ballroom),
12798,"Fri, 03 Apr 2015 20:15:00 +0800","Fri, 03 Apr 2015 20:30:00 +0800",FF - Why Once Upon A Time is Better than Fanfiction,"15 Minutes, TV",Samara Morgan,North Hamersley (Gaming and Others),
12799,"Fri, 03 Apr 2015 20:00:00 +0800","Fri, 03 Apr 2015 20:15:00 +0800",FF - Black Mirror,"15 Minutes, TV",Jonathan Durnford,North Hamersley (Gaming and Others),
12800,"Sun, 05 Apr 2015 14:15:00 +0800","Sun, 05 Apr 2015 14:30:00 +0800",FF - Ancillary Justine by Annie Leckie,"15 Minutes, TV",Gina Goddard,Centre Ballroom (Med Ballroom),
12801,"Sun, 05 Apr 2015 14:30:00 +0800","Sun, 05 Apr 2015 14:45:00 +0800",FF - Collected works of Neil Gaiman and Amanda Palmer in 10 minutes,"15 Minutes, Art / Artistic, Comics, Literature",Sarah Xu,Centre Ballroom (Med Ballroom),
12802,"Sun, 05 Apr 2015 14:00:00 +0800","Sun, 05 Apr 2015 14:15:00 +0800",FF - Poison Elves Comic,"15 Minutes, Comics",Colin Sharpe,Centre Ballroom (Med Ballroom),
12803,"Fri, 03 Apr 2015 10:45:00 +0800","Fri, 03 Apr 2015 11:00:00 +0800",FF - How To Be More Skeptical 101,"15 Minutes, Academic, Science and Tech",Kylie Sturgess,North Hamersley (Gaming and Others),
12804,"Sat, 04 Apr 2015 14:15:00 +0800","Sat, 04 Apr 2015 14:30:00 +0800",FF - Hanako Games,"15 Minutes, Gaming, Video Games",Sophie Ambrose,Centre Ballroom (Med Ballroom),
12805,"Sun, 05 Apr 2015 10:00:00 +0800","Sun, 05 Apr 2015 11:00:00 +0800",A Guide to Femslash Fandom,"Fandom, Fantasy","Sophie Ambrose, Anna Hepworth",Hamersley South (Small Panel Room),"What makes fictional girls kissing so great, and where can you find it?"
12808,"Fri, 03 Apr 2015 19:45:00 +0800","Fri, 03 Apr 2015 20:00:00 +0800",FF - Defiance,"15 Minutes, TV",Candice Schilder,North Hamersley (Gaming and Others),
12809,"Sat, 04 Apr 2015 12:00:00 +0800","Sat, 04 Apr 2015 12:30:00 +0800",Dave Luckett - Reading - 'Legacy of Scars',Reading,Dave Luckett,Hamersley South (Small Panel Room),
12810,"Sun, 05 Apr 2015 12:00:00 +0800","Sun, 05 Apr 2015 13:00:00 +0800",Kaffeeklatsch - Helen Stubbs,"Discussion, Writing",Helen Stubbs,Alternate Venue (Check Details),"In the Foyer to the right (near the Bar) 
Pre-purchased memberships can purchase tickets to this in advance. $5 per ticket. Maximum of 10 attendees."
12811,"Sun, 05 Apr 2015 16:00:00 +0800","Sun, 05 Apr 2015 17:00:00 +0800",Kaffee Klatsch - Kylie Chan (2),"Discussion, Guest of Honour Item, Writing",Kylie Chan,Alternate Venue (Check Details),"In the Foyer to the right (near the Bar) 
Pre-purchased memberships can purchase tickets to this in advance. $5 per ticket. Maximum of 10 attendees."
12812,"Sun, 05 Apr 2015 11:00:00 +0800","Sun, 05 Apr 2015 12:00:00 +0800",Ladies Comic Book Club,"Comics, Discussion","Violet Auld, Sigrid Edwards, Billie Harvey",North Ballroom (Large ballroom),"""Based in Perth, Western Australia, the LCBC sponsored by Comiczone is a monthly meet-up exclusively for women focusing on a selected comic text to discuss in a book club format. The club caters to both to comic novices and experienced readers. The LCBC is all about creating a physical space free of judgement for women who are often targeted for being interested in a traditionally ‘male oriented’ activity. There is a risk that creating an exclusively female event would perpetuate the sort of negative, sex- and gender-based negativity we see manifest in things such as “Gamergate”. However, this event and its purposes do not have any root in strengthening the split between fans based on sex/gender. The events advocate a love of comics, not anything else. Although the LCBC is undeniably exclusive, it’s not anti-male. It is better described as pro-female."""
12813,"Sat, 04 Apr 2015 17:00:00 +0800","Sat, 04 Apr 2015 18:00:00 +0800",Crits and Grits - When Are Crit Groups A Good Idea? ,Writing,"Anthony Panegyres, Carol Ryles, Keith Stevenson, Helen Stubbs",North Hamersley (Gaming and Others),"Crit groups and writing groups are an important part of the business of writing. When do you need to find one? When you do, how do you handle hearing things you don't want to hear? Will you ever be friends again? Do you ever NOT need a critgroup?"
12814,"Sun, 05 Apr 2015 15:00:00 +0800","Sun, 05 Apr 2015 16:00:00 +0800",Kaffeeklatsch - Glenda Larke,"Discussion, Writing",Glenda Larke,Alternate Venue (Check Details),"In the Foyer to the right (near the Bar) 
Pre-purchased memberships can purchase tickets to this in advance. $5 per ticket. Maximum of 10 attendees."
12815,"Sun, 05 Apr 2015 12:00:00 +0800","Sun, 05 Apr 2015 13:00:00 +0800","Social Media, Marketing and Writing",Writing,"Amanda Bridgeman, Kylie Chan, Devin Jeyathurai, Louisa Loder, Gillian O'meagher",North Hamersley (Gaming and Others),"MODERATOR: DEVIN JEYATHURAI
Social Media is a key advertising tool for the aspiring writer, or is it? Our panellists will look at Socmed as a platform to get your name out there, and maybe even talk about the way Narratives can fit within 120 characters, or a string of sentences can become a story, and all as a way to capture the attention of new readers."
12816,"Sat, 04 Apr 2015 10:00:00 +0800","Sat, 04 Apr 2015 11:30:00 +0800",Tournament - Halfling Heist,Participation Game,"Bronwyn McDougall, Tim McDougall",Gaming Room (Goldsworthy),"""Halfling Heist is a fast-paced board game that pits you against three other rival Halfling thieves. Snatch as much food as possible and scram before the City Watch catches you red-handed with someone else’s chicken sandwich. It’s quick, fun and brutal as you dodge the barroom brawl and try to outgrab and outscore your fellow Halflings. The more hits you take, the more Luck you’ll gain - just make sure you get out in time to enjoy your meal!"
12817,"Sun, 05 Apr 2015 14:00:00 +0800","Sun, 05 Apr 2015 16:00:00 +0800",Tournament - Dixit,Participation Game,"Rob Masters, Leece Smith",Gaming Room (Goldsworthy),"How Well Do You Know People? Will your friend get that esoteric reference you were talking about just the other day? There will be a Dixit Tournament of an elimination round for up to 36 players followed by a final round for the winning six.

Dixit is a beautiful game with surreal, dreamlike cards. During the game the player selects a card, and indicates something about it or what it inspires to the other players without showing it to them. The other players choose cards from their hands that they think might also evoke this thing. The selected cards are all shuffled and laid out face up for players to vote on – which was the original card? Subtle, beautiful and described both as a party game for gamers and a gamer's game for party gamers Dixit is a game everyone should try at least once. Preferably with a whole bunch of strangers and one person you know very well."
12818,"Sun, 05 Apr 2015 19:30:00 +0800","Sun, 05 Apr 2015 20:30:00 +0800","This game is so good, I'm prepared to speak for 3 minutes in public on it. (1)","Discussion, Gaming","Ellora Ker, Rob Masters, Leece Smith",North Hamersley (Gaming and Others),Are you passionate about a game? You have 3 minutes to give a lightning presentation to persuade the audience that the game is worth trying! Watch as 9 other people speak passionately about games they think are worth it.
12819,"Mon, 06 Apr 2015 11:00:00 +0800","Mon, 06 Apr 2015 12:00:00 +0800","This game is so good, I'm prepared to speak for 3 minutes in public on it. (2)",Gaming,"Rob Masters, Rob Masters, Leece Smith",North Hamersley (Gaming and Others),Are you passionate about a game? You have 3 minutes to give a lightning presentation to persuade the audience that the game is worth trying! Watch as 9 other people speak passionately about games they think are worth it.
12820,"Sat, 04 Apr 2015 12:30:00 +0800","Sat, 04 Apr 2015 13:00:00 +0800",Robert Hood - Reading -  'Peripheral Visions',Reading,Robert Hood,Hamersley South (Small Panel Room),Peripheral Visions
12821,"Fri, 03 Apr 2015 09:45:00 +0800","Fri, 03 Apr 2015 10:00:00 +0800",Welcome to Swancon,Conrunning,"",North Ballroom (Large ballroom),
12822,"Fri, 03 Apr 2015 13:45:00 +0800","Fri, 03 Apr 2015 14:00:00 +0800",Welcome to Swancon,Conrunning,"",North Ballroom (Large ballroom),
12823,"Sat, 04 Apr 2015 09:45:00 +0800","Sat, 04 Apr 2015 10:00:00 +0800",Welcome to Swancon,Conrunning,"",North Ballroom (Large ballroom),
12824,"Sat, 04 Apr 2015 13:45:00 +0800","Sat, 04 Apr 2015 14:00:00 +0800",Welcome to Swancon,Conrunning,"",Hamersley South (Small Panel Room),
12825,"Sat, 04 Apr 2015 14:00:00 +0800","Sat, 04 Apr 2015 15:00:00 +0800",Climate Change - is it Affecting our Spec Fic?,"Writing, Writing","Glenda Larke, Cat Sparks, Keith Stevenson",Hamersley South (Small Panel Room),"There’s a strand of SF that likes to consider our ultimate demise. In the middle of the last century that was likely to be through nuclear conflagration. Nowadays it’s climate change disaster. But portraying the antagonist as an elemental force rather than a ‘bunch of nuke-crazy Reds’ brings its own challenges from a writing perspective. How have writers tackled these very real fears over the past decade or so, and is there still room for a happy ending?"
12826,"Sat, 04 Apr 2015 11:30:00 +0800","Sat, 04 Apr 2015 13:00:00 +0800",The Hollow Reaches Playtest (1),Participation Game,"Rowan Ashwin, Roland Kerr, Jon Van Buren, Frames White",Gaming Room (Goldsworthy),"RetCon games, Perth's newest gaming start-up, would like to invite you to help playtest a fresh new game: The Hollow Reaches. It is a fast-paced, procedurally generated, Rogue-like, RPG card-game. Join us to playings as the mysterious agents of an even more mysterious entity. Expect armies of foes to fall in your wake. Expect challenging problems and moral dilemmas. Expect a system with unique mechanics, that has never seen public play before."
12827,"Sun, 05 Apr 2015 10:00:00 +0800","Sun, 05 Apr 2015 12:00:00 +0800",The Hollow Reaches Playtest (2),Participation Game,"Rowan Ashwin, Roland Kerr, Jon Van Buren, Frames White",Gaming Room (Goldsworthy),"RetCon games, Perth's newest gaming start-up, would like to invite you to help playtest a fresh new game. It is a fast-paced, procedurally generated, Rogue-like, RPG card-game. Join us to playings as the mysterious agents of an even more mysterious entity. Expect armies of foes to fall in your wake. Expect challenging problems and moral dilemmas. Expect a system with unique mechanics, that has never seen public play before."
12828,"Fri, 03 Apr 2015 14:00:00 +0800","Fri, 03 Apr 2015 15:00:00 +0800",Costuming for Fun and Effect!,"Fandom, X For Beginners","Sarah Akers, Pax Weber",Centre Ballroom (Med Ballroom),"""What to wear? Costuming can be fun, daring, frightening, cheap or expensive. The difference between fantastic and forgettable can often lie in the first stages of planning. We hope to take you through some of the steps of choosing a costume, and tips for execution. Or; How to make a costume for fun and effect"""
12829,"Mon, 06 Apr 2015 14:00:00 +0800","Mon, 06 Apr 2015 14:30:00 +0800",Trailer Park - Children and Families,"Family, Film, TV",David Gunn,Hamersley South (Small Panel Room),
12830,"Sat, 04 Apr 2015 14:30:00 +0800","Sat, 04 Apr 2015 15:00:00 +0800","Launch - Louisa Loder - ""Stormfate""",Launch,Louisa Loder,North Hamersley (Gaming and Others),"Take a glimpse into the monster-ravaged land of Padallia at the launch of Stormfate, the bite-sized fantasy novella by local novelist Louisa Loder.
==========================
Under the endless spread of trees in the infamous Fallow Wood, the remaining forces of the Royal Guard feel the tension of the gathering storm and begin to question their leadership . Even with his best friend Valnor by his side, King Hadrian is on edge and feels helpless to protect the land of Padallia. High above the city of Dunarran, Queen Ardea maintains a worried vigil over the dark stain of the Wood from her tower window and watches for her husband's return. Wylden, a Fae Ranger, is also caught in the storm as he searches for the answers that his Elders are unwilling to give him.

The storm breaks with an unparalleled ferocity, and rages through the night. No one escapes unscathed, and Padallia will be changed forever."
12831,"Mon, 06 Apr 2015 11:00:00 +0800","Mon, 06 Apr 2015 12:00:00 +0800",Anthony and Grant The Non-Writerly Interview,"Discussion, Guest of Honour Item","Anthony Peacey, Grant Stone",Centre Ballroom (Med Ballroom),"Anthony and Grant Stone are the cornerstones of Swancon. From humble beginnings in Anthony's house with a handful of people and a clutch of hatching ducklings to hundreds of people in a very shiny hotel, Swancon has grown organically over the last 40 years. Come along and ask questions in this informal discussion with two of Perth's fandom veterans."
12832,"Sat, 04 Apr 2015 15:00:00 +0800","Sat, 04 Apr 2015 16:00:00 +0800","What's happening with the Square Kilometre Array, and the Murchison Widefield Array",Science and Tech,Andrew Williams,Hamersley South (Small Panel Room),"Dr Andrew Williams, Curtin University

The Square Kilometre Array will be the biggest telescope ever built, tens or hundreds of times more sensitive than any other radio telescope. It's going to be built on two sites, one in South Africa and the other here in WA. The only problem was that the original design was costed at three times as much money as was available to build it...

The complex 're-baselining' negotiations have just finished, and the SKA office have released the new SKA layout and adjusted timeline. I'll talk about what that will mean to the project as a whole as well as us here in WA. I'll also talk about the telescope I work on, the Murchison Widefield Array, a direct precursor to the low-frequency part of the SKA."
12833,"Sat, 04 Apr 2015 16:00:00 +0800","Sat, 04 Apr 2015 17:00:00 +0800",Looking Beyond the Left Hand: Gender and Sexuality in Contemporary SF,"Literature, new","Alisa Krasnostein, Alex Pierce",Hamersley South (Small Panel Room),"It has been more than 45 years since Ursula Le Guin’s novel The Left Hand of Darkness stunned readers with its thoughtful and ground-breaking portrayal of shifting gender and sexuality. Almost five decades later, it remains one of the commonly cited examples of science fiction that pushes the boundary of gender identity and sexuality. How far have we come since then? How are contemporary writers exploring these concepts and ideas, and to what extent – if any – has the real world followed or even overtaken them? What responsibility do authors have to reflect or provoke gender issues in their fiction?"
12834,"Fri, 03 Apr 2015 10:00:00 +0800","Fri, 03 Apr 2015 11:00:00 +0800",Reframed and Repackaged: SF as literature,"new, new, Writing","Tsana Dolichva, Cat Sparks",Hamersley South (Small Panel Room),"Some of the best speculative fiction available can’t be found in the science fiction or fantasy sections of the bookshop - you need to go hunting in the “literature” shelves for Attwood, Palahniuk and Murakami, among others. A discussion on why authors and publishers choose or are encouraged to be marketed within or without the genre they are writing in, and in some cases to refuse to acknowledge genre at all. What makes a book science fiction, and what makes it literature?"
12835,"Fri, 03 Apr 2015 14:00:00 +0800","Fri, 03 Apr 2015 15:00:00 +0800",Teenage Juggernaut: The Runaway Success of Young Adult Fiction,"Literature, new","Tsana Dolichva, Alex Pierce, Tehani Wessely",North Ballroom (Large ballroom),"It has been impossible not to notice the enormous commercial and critical success of young adult fiction over the past decade, as science fiction and fantasy books ostensibly aimed at teenage readers leap into the bestsellers charts and are regularly picked up by Hollywood to create the latest big-budget Summer blockbusters. What happened for YA fiction to become such a popular type of literature? What, if anything, does it offer that adult fiction does not? How useful is it as a form for creating speculative fiction, and what are its limitations? Most importantly of all: where does YA go from here?"
