id,start_time,end_time,title,tags,people,venues,description
12388,"Fri, 03 Apr 2015 13:00:00 +0800","Fri, 03 Apr 2015 14:00:00 +0800",Lunch,Break,"","",
12389,"Sat, 04 Apr 2015 13:00:00 +0800","Sat, 04 Apr 2015 14:00:00 +0800",Lunch,Break,"","",
12390,"Sun, 05 Apr 2015 13:00:00 +0800","Sun, 05 Apr 2015 14:00:00 +0800",Lunch,Break,"","",
12392,"Mon, 06 Apr 2015 13:00:00 +0800","Mon, 06 Apr 2015 14:00:00 +0800",Lunch,Break,"","",
12394,"Fri, 03 Apr 2015 18:00:00 +0800","Fri, 03 Apr 2015 19:30:00 +0800",Dinner,Break,"","",
12395,"Sat, 04 Apr 2015 18:00:00 +0800","Sat, 04 Apr 2015 19:30:00 +0800",Dinner,Break,"","",
12396,"Sun, 05 Apr 2015 18:00:00 +0800","Sun, 05 Apr 2015 19:30:00 +0800",Dinner,Break,"","",
12398,"Fri, 03 Apr 2015 21:30:00 +0800","Fri, 03 Apr 2015 23:59:00 +0800",Beefcake!!! The Third,Adult Only,"Kitty Byrne, Kat Griffiths",Hamersley South (Small Panel Room),"Beefcake III: The Beefening!

Come along for the updated, revamped, and actually organised for once Beefcake. No, really. We're organised."
12399,"Fri, 03 Apr 2015 16:30:00 +0800","Fri, 03 Apr 2015 18:00:00 +0800",Geekling Sing-A-Long,"Family, Fandom, Young Adult",Desiree Heald,Family Room (Boardroom),"Geeks and Geeklings come along and sing for your favourite children's cartoon theme songs. 
Astroboy!
Kimba!
My Little Pony, both old and new!"
12402,"Fri, 03 Apr 2015 19:30:00 +0800","Fri, 03 Apr 2015 20:30:00 +0800",Swancon History Panel 0 - 20 Years,"Fandom, Guest of Honour Item","Stephen Dedman, Anthony Peacey, Grant Stone",Hamersley South (Small Panel Room),Interesting stories from when Swancon was young.
12410,"Sun, 05 Apr 2015 19:30:00 +0800","Sun, 05 Apr 2015 20:30:00 +0800","Unusual Pairings in FanFic - the Good, the Bad, the Ugly",Transformative Works,"Belinda Forbes, Katherine McFarlane, Sarah McFarlane, Sandy Norman, Sarah Xu",Hamersley South (Small Panel Room),"In the world of fanfiction, there are some things that we just HATE and somethings we just love. What are your pet peeves? What are you pet pairings? Do Donna and Jack really live happily ever after?"
12411,"Fri, 03 Apr 2015 11:00:00 +0800","Fri, 03 Apr 2015 12:00:00 +0800",GoH - Speech - Kylie Chan,Guest of Honour Item,"",North Ballroom (Large ballroom),"Kylie's Guest of Honour Speech
North and centre ballroom as one"
12412,"Sat, 04 Apr 2015 11:00:00 +0800","Sat, 04 Apr 2015 12:00:00 +0800",GoH - Speech - John Scalzi,Guest of Honour Item,John Scalzi,North Ballroom (Large ballroom),"John Scalzi rants, raves, and goes ballistic over whatever the hell he likes."
12413,"Sat, 04 Apr 2015 20:00:00 +0800","Sat, 04 Apr 2015 23:59:00 +0800",Masquerade,Event,Jade Rolfe,North Ballroom (Large ballroom),
12414,"Thu, 02 Apr 2015 21:00:00 +0800","Thu, 02 Apr 2015 22:00:00 +0800",Riding The Iron Bull: Why Is Dragon Age Inquisition So Damn Good?,"Gaming, Video Games",Jetha Chan,Centre Ballroom (Med Ballroom),
12423,"Sun, 05 Apr 2015 17:00:00 +0800","Sun, 05 Apr 2015 18:00:00 +0800",Kaffeeklatch - Donna Maree Hansen,"Discussion, Writing","",Alternate Venue (Check Details),kaffeeklatch
12425,"Sun, 05 Apr 2015 11:00:00 +0800","Sun, 05 Apr 2015 12:00:00 +0800",Kaffeeklatch - Kylie Chan (1),"Discussion, Guest of Honour Item, Writing",Kylie Chan,Alternate Venue (Check Details),"In the Foyer to the right (near the Bar) 
Pre-purchased memberships can purchase tickets to this in advance. $5 per ticket. Maximum of 10 attendees."
12426,"Thu, 02 Apr 2015 19:30:00 +0800","Thu, 02 Apr 2015 20:00:00 +0800",Moderate Moderators: The HOWTO panel,"Conrunning, Fandom",Sarah Parker,Hamersley South (Small Panel Room),"Moderate Moderators - are you a moderator this year? If so come along to see your fellow moderators discuss ways and means to handle the speakers at Swancon. We aim for firm but fair, and sometimes we all need a little help in remaining calm, cool and collected. We look at tips to handle the most unruly, and ways to ensure your panel and speakers are a success!"
12427,"Sun, 05 Apr 2015 12:00:00 +0800","Sun, 05 Apr 2015 13:00:00 +0800",GOH - Speech - Anthony Peacey,Guest of Honour Item,"",North Ballroom (Large ballroom),
12428,"Sun, 05 Apr 2015 20:00:00 +0800","Sun, 05 Apr 2015 23:30:00 +0800","Awards - Ditmars, Tin Ducks, ETC",Event,"",North Ballroom (Large ballroom),Awards night - be sure to dress for the occasion! We're hosting the National awards this year as well as the locals.
12429,"Mon, 06 Apr 2015 11:00:00 +0800","Mon, 06 Apr 2015 13:00:00 +0800",WASFF Business Meeting,Conrunning,"",Hamersley South (Small Panel Room),WASFF AGM. Yay?
12430,"Sun, 05 Apr 2015 11:00:00 +0800","Sun, 05 Apr 2015 13:00:00 +0800",Natcon Business Meeting,Conrunning,"",Hamersley South (Small Panel Room),Natcon Business Meeting
12431,"Mon, 06 Apr 2015 16:00:00 +0800","Mon, 06 Apr 2015 16:30:00 +0800",Closing Ceremony,"Conrunning, Guest of Honour Item","Kitty Byrne, Kylie Chan, Helen Duffill, Kat Griffiths, Stephen Griffiths, Matt Holmes, Katherine McFarlane, Sarah McFarlane, John Parker, Sarah Parker, Anthony Peacey, Brendan Ragan, John Scalzi",Centre Ballroom (Med Ballroom),Closing ceremony. Come cry that another year is over. And remember to buy your ticket for next year!
12432,"Sun, 05 Apr 2015 15:00:00 +0800","Sun, 05 Apr 2015 16:00:00 +0800",Spec Fic Writing - Science Potrayal in Fiction ,"JP Review, Writing","PRK , Amanda Bridgeman, Tsana Dolichva, Donna Maree Hanson, Leonie Rodgers, John Scalzi, Helen Stubbs",North Hamersley (Gaming and Others),"MODERATOR: PRK
Speculative Fiction Writing Panel, looking at the way science is portrayed in writing. Science is often held as the bastion of hope, answering a need unfulfilled by religion, but faith is only a part of a good spec fic story. When using science, what are the good parts and the bad parts? How can we be better at it without memorizing physics books?"
12433,"Mon, 06 Apr 2015 14:00:00 +0800","Mon, 06 Apr 2015 15:00:00 +0800",Homework Panel for 2016,"Fantasy, Sci-Fi","Frames White, Isobel White",Centre Ballroom (Med Ballroom),"Now we know who the rather awesome Guests of Honour will be for 2016, come along and find out what works the 2016 committee recommend we consume so we are ready for next year."
12434,"Sat, 04 Apr 2015 14:00:00 +0800","Sat, 04 Apr 2015 14:30:00 +0800",Launch 2016 Prep,"Launch, Prep","",North Ballroom (Large ballroom),
12435,"Sat, 04 Apr 2015 14:30:00 +0800","Sat, 04 Apr 2015 15:00:00 +0800",Launch 2016,Launch,"",North Ballroom (Large ballroom),Launch
12441,"Fri, 03 Apr 2015 19:30:00 +0800","Fri, 03 Apr 2015 21:30:00 +0800",Let's build a Civilisation: One Continent,Art / Artistic,"",North Ballroom (Large ballroom),"On an otherwise boring Blue-Green world, orbiting a rather normal G type main sequence star lies the continent of Swanconia. Let's build the people, lands, countries and economy of this remarkable world.
Like worldbuilding, but less likely to degenerate to ""Bat creatures living in blobs of water in a universe ENTIRELY MADE OF ICE!!!one!"""
12443,"Fri, 03 Apr 2015 22:30:00 +0800","Fri, 03 Apr 2015 23:30:00 +0800",Evil Overlord Training School,"Fantasy, Sci-Fi","Chris Coman, Jonathan Durnford",Centre Ballroom (Med Ballroom),"workshop: get people to come up with the most practical, savvy Evil Overlord possible (competition maybe?) - Kim"
12444,"Fri, 03 Apr 2015 15:00:00 +0800","Fri, 03 Apr 2015 16:00:00 +0800",Anime (and Manga) for ABSOLUTE Beginners,Anime / Manga,"",Hamersley South (Small Panel Room),"So you have seen some dubbed TV that someone described as ""Anime"" and you are curious. You want to watch more (And also read some of the strange ""Manga"" they are based on) but there's so much stuff out there and you don't know where to start. Our friendly panelists are here to help!"
12446,"Thu, 02 Apr 2015 21:00:00 +0800","Thu, 02 Apr 2015 22:00:00 +0800",Trailer Park - Adult Themes,Film,David Gunn,North Ballroom (Large ballroom),"For those who are new to Swancon, Trailer Park is a review of up coming trailers for next years movies and shows."
12447,"Fri, 03 Apr 2015 12:00:00 +0800","Fri, 03 Apr 2015 13:00:00 +0800",Food as Worldbuilding,"Fantasy, Writing","Devin Jeyathurai, Glenda Larke",North Hamersley (Gaming and Others),"A critical analysis on how food is used in world building to develop a sense of atmosphere in creative works. Everybody eats – but how does what they eat tell you about how they live? What traditions, customs, and flavours dominate the local food? In what ways can the protagonist highlight or learn things about themselves from their experiences? Food has been used in books such as the Kushiels’ Dart series, A Song of Fire and Ice, and the Legend of the Seeker. How did the authors use food in their books?

Soylent green is people."
12450,"Sat, 04 Apr 2015 22:30:00 +0800","Sat, 04 Apr 2015 23:30:00 +0800",Sing-Along with Sauron,Fandom,Desiree Heald,Centre Ballroom (Med Ballroom),Geek Sing A long for Adults
12451,"Fri, 03 Apr 2015 17:00:00 +0800","Fri, 03 Apr 2015 18:00:00 +0800","Who Owns ""Culture"", anyway? Working outside your own.",Literature,"PRK , Kylie Chan, Devin Jeyathurai",Centre Ballroom (Med Ballroom),"MODERATOR: PRK
Many stories are told from outside our own cultural ""boundaries"", either as a direct transplant or a cultural ""homage"". What should we be aware of when we do this? What problems can happen? How do you make sure you aren't being offensive or inappropriate?"
12452,"Fri, 03 Apr 2015 12:00:00 +0800","Fri, 03 Apr 2015 13:00:00 +0800",Christopher vs Collins: Dystopias Past and Present,Books,"Tsana Dolichva, Leonie Rodgers, Cat Sparks, Sean Williams",Centre Ballroom (Med Ballroom),"Young adult dystopias panel (ie, Hunger games, Divergent, others etc)"
12453,"Mon, 06 Apr 2015 15:00:00 +0800","Mon, 06 Apr 2015 16:00:00 +0800","""Not Dead Yet"" - 40 years of Monty Python and the Holy Grail","","",Hamersley South (Small Panel Room),"At last the Monty Python panel, and what better subject than the OTHER thing turning 40 this year? 
The Black Knight, naughty Nuns and what exactly IS the air-speed velocity of an unladen swallow? (African -or- European)"
12461,"Sun, 05 Apr 2015 14:00:00 +0800","Sun, 05 Apr 2015 15:00:00 +0800",Then and Now: A comparison between 2015 and 1974 in the SFF scene.,"Fandom, Film, Guest of Honour Item, Literature, TV","Damian Magee, Anthony Peacey",Hamersley South (Small Panel Room),"We have a look across fandom between the early days of the Perth Scene and now. What did we do then that we don't do any more? What do we do now that would seem impossible back then? What do we still do? Lets look at the year Swancon began! A look at the genre of the time, what books were released, what TV shows graced the screens and movies, music and more."
12467,"Sun, 05 Apr 2015 21:30:00 +0800","Sun, 05 Apr 2015 22:30:00 +0800",Jonathan's God Panel,"Academic, Discussion",Jonathan Durnford,Centre Ballroom (Med Ballroom),God’s Advocate - devil’s advocate panel in which I will defend fundamental christianity and the bible from the audience who will attempt to dissuade me (Jonathan)
12492,"Fri, 03 Apr 2015 16:00:00 +0800","Fri, 03 Apr 2015 17:00:00 +0800","Enligtenment vs Resistance: Ingress, a globetrotting real world MMO.",Gaming,Erin Stark,North Ballroom (Large ballroom),"Come and find out about Ingress, a rapidly growing ""Real World"" MMO based on digital interactions with real world objects. Find out about the two factions, the methods of the game and why so many people in Perth have joined."
12493,"Mon, 06 Apr 2015 15:00:00 +0800","Mon, 06 Apr 2015 16:00:00 +0800",Dark Dungeons: Who is Jack Chick?,"","Dave Cake, Devin Jeyathurai, Grant Stone",North Ballroom (Large ballroom),"Dark Dungeons is an unironic exploration of roleplaying as evil, as seen through the eyes of Jack Chick. jack Chick is famous for creating a series of badly drawn comics depicting DnD as dangerous and evil, and these comics being printed and distributed by hand to mailboxes around Australia (and America?) Come and find out more about the Chick Tracts and see the trailer/opening scenes from the movie ""Dark Dungeons"""
12500,"Mon, 06 Apr 2015 11:00:00 +0800","Mon, 06 Apr 2015 12:00:00 +0800",History of Roguelikes - from Rogue to Crawl,"Fantasy, Video Games","Devin Jeyathurai, John Parker",North Ballroom (Large ballroom),"The genre that continues. From it's earliest roots on mainframes with DND and Rogue, through it's continued evolution and the impact on the greater gaming mindset, with concepts like randomly generated dungeons (Diablo, Torchlight), Permadeath (Don't Starve) and weird artifacts that need to be explored to be understood (Borderlands)"
12502,"Mon, 06 Apr 2015 15:00:00 +0800","Mon, 06 Apr 2015 16:00:00 +0800","SMOF, Dane and Filk: Exploring the geek lexicon",Fandom,"",Centre Ballroom (Med Ballroom),Words and phrases only used in the geek and fannish community.
12507,"Fri, 03 Apr 2015 15:00:00 +0800","Fri, 03 Apr 2015 16:00:00 +0800",More than just extra Umlats: Names and naming conventions in SF/F,"JP Review, Writing",Keith Stevenson,North Hamersley (Gaming and Others),"How do we come up with our naming and language themes? We have serious amounts of work going into creating good name / language structures. eg themed names, linguistic structures"
12515,"Sat, 04 Apr 2015 17:00:00 +0800","Sat, 04 Apr 2015 18:00:00 +0800",Magical and SF Detective Fiction: Police Procedurals and similar in non mainstream settings.,Literature,"Stephen Dedman, Alex Isle, Leece Smith",Centre Ballroom (Med Ballroom),"Whether it's Master Li and Number 10 Ox, Tom Dreyfus, Harry Dresden, Detective Chen or Eve Dallas the panelists will discuss their favourites and what makes this mix of genres so entertaining."
12518,"Thu, 02 Apr 2015 22:00:00 +0800","Thu, 02 Apr 2015 23:00:00 +0800",The Reverse of the Return of the Sequel to the Trilogy of Just Who's Line?,"Gaming, JP Review","",Hamersley South (Small Panel Room),
12519,"Sun, 05 Apr 2015 10:00:00 +0800","Sun, 05 Apr 2015 11:00:00 +0800",Old Games are New Again: The revival of classics in new ways,Gaming,"Ellora Ker, Rob Masters, Leece Smith",North Hamersley (Gaming and Others),"Monopoly, Battleships, Risk and the rest of the stable of ""classic"" games are getting new editions with new art, new rules and new tie ins. Does this help elevate them beyond their roots or is this the death rattle of the ""old school"" in the face of the newer ""euro-games"" style systems."
12521,"Sat, 04 Apr 2015 16:00:00 +0800","Sat, 04 Apr 2015 17:00:00 +0800",UggTect Royale - The Second Clubbing,"Gaming, Science and Tech","Rob Masters, Rob Masters, Leece Smith",North Hamersley (Gaming and Others),"as seen in 2014

Ugg-Tect Royale: The Second Clubbing.
 Ugg-Tect Royal will be showing at Swancon 40. This modification of the hilarious Ugg-Tect party game pits 4 highly skilled (mystified looks a specialty) along with their long suffering Ugg-Tects against each other in a race to complete megalithic monuments. While the audience and the Ugg-Tects know what the structure is meant to look like, the builders have no idea, and instructions are in strict caveman talk and gesture.
Leece & Rob are for looking for up to 16 participants with good communications skills and the ability to work in a small, tightly integrated team. They must be willing to provide endless looks of confusion, bafflement and frustration."
12523,"Fri, 03 Apr 2015 09:30:00 +0800","Fri, 03 Apr 2015 10:30:00 +0800",Drawing Composite monsters: A collaboration,"Art / Artistic, Fantasy",Leece Smith,North Hamersley (Gaming and Others),"Free form audience participation thing - I'll either select people to come and draw the bits, or if no one wants to come up, I'll get the audience to select the species of beast that the bits come from.

Leece: Alright, what species of eagle do you want the gryphon's wings to come from? 

Audience member: Wedgetail!

If all goes well, it could be a combination of both, we will just have to see how we go on the evening"
12525,"Sun, 05 Apr 2015 17:00:00 +0800","Sun, 05 Apr 2015 18:00:00 +0800",Short and Sweet: Games you can play in under 30 minutes,Gaming,"Warren Adams, Leece Smith, Leece Smith",North Hamersley (Gaming and Others),Fun games you can play in under 30 minutes (followed by demo session in gaming room )
12528,"Thu, 02 Apr 2015 20:00:00 +0800","Thu, 02 Apr 2015 21:00:00 +0800",The Warrior Awakens: Military Sci Fi - an Appreciation,"Literature, Sci-Fi, TV","PRK , John Scalzi, Frames White",North Ballroom (Large ballroom),Why is Military Sci-Fi such a successful sub-genre? Why do so many of us like to read about the wars of the future? What tactics and mechanics need to change when our battles are pitched in space or on other planets?
12529,"Mon, 06 Apr 2015 10:00:00 +0800","Mon, 06 Apr 2015 11:00:00 +0800",State of the Art Director: What can (and cannot) be done in SFX,Film,"",Centre Ballroom (Med Ballroom),"With big budget Sci Fi, fantasy and Comic adaptions all the rage, and CGI and practical effects reaching new levels of realism and sophistication, we look at what can (and what cannot) be put on the screen."
12531,"Sat, 04 Apr 2015 21:30:00 +0800","Sat, 04 Apr 2015 22:30:00 +0800",Paranormal Romance : What hasn't been done?,Adult Only,Rebecca Laffar-Smith,Centre Ballroom (Med Ballroom),"Werewolves, Vampires sure. Zombies... Ohkay. Unicorns, um. How would that even work? Dragons? Gryphons? SANDWORMS???"
12532,"Mon, 06 Apr 2015 12:00:00 +0800","Mon, 06 Apr 2015 13:00:00 +0800",Everyone take a Chill Pill!: Non-violent RPGs and computer games. ,"Video Games, Video Games","",North Hamersley (Gaming and Others),What non violent RPGs and Computer games are there out there?
12533,"Mon, 06 Apr 2015 12:00:00 +0800","Mon, 06 Apr 2015 13:00:00 +0800",What do we wear from here?: The future of Smart Wearables,"JP Review, Science and Tech","Dave Cake, Matt Holmes",Centre Ballroom (Med Ballroom),"So Google Glass seems to be somewhat of a failure, yet at the same time Microsoft are launching their own AR games platform. Smart watches seem to be in every catalog, but a watch you need to charge every 3 hours seems less than practical. What is coming down the pipe. What is next? What do you do when your implanted tech gets obsoleted?"
12542,"Sat, 04 Apr 2015 12:00:00 +0800","Sat, 04 Apr 2015 13:00:00 +0800",Return of the Editors Strike Back,Writing,"Kylie Chan, Stephen Dedman, Andrew Harvey, Cat Sparks",Centre Ballroom (Med Ballroom),"MODERATOR: STEPHEN DEDMAN
A panel of editors (or former editors) of sf magazines and publishers do a blind reading of first pages of anonymous submissions from writers (who will, ideally, be in the audience), and vote/comment on whether they'd be inclined to continue reading. Work would be read aloud, but authors not identified unless they spoke up."
12543,"Sat, 04 Apr 2015 16:00:00 +0800","Sat, 04 Apr 2015 17:00:00 +0800",The Sword Drawn! Kitty and John Explore Excalibur,Comics,"Kitty Byrne, John Parker",Centre Ballroom (Med Ballroom),"In our third (of what has mutated into a strange tradition) panel exploring Chris Claremont derived titles, we explore the critically acclaimed XMen spinoff, Excalibur, from it's roots in Captain Britain (With writing by Alan Moore!) through the good years, the bad years and everything inbetween. 
This year we have prepared!(This will only cover the English superhero team, not the later American teams with a similar name)"
12545,"Fri, 03 Apr 2015 17:00:00 +0800","Fri, 03 Apr 2015 18:00:00 +0800",Writing Video Games for Fun and Profit,"Video Games, Video Games","",North Hamersley (Gaming and Others),From people trying their hardest to get there.
12547,"Fri, 03 Apr 2015 10:00:00 +0800","Fri, 03 Apr 2015 11:00:00 +0800",Ant Who Now? Characters who deserve a movie before Antman,Comics,"",Centre Ballroom (Med Ballroom),"Antman gets a movie and we all say WTF?
Who should be on the big screen first and why.

There are SOOOOOOOO MANY characters who deserve a film more than Ant-Man. Two of those characters have now had a film announced. 

In this very short presentation, learn who those characters are and why they need a film. This panel is strictly Marvel."
12554,"Sun, 05 Apr 2015 14:00:00 +0800","Sun, 05 Apr 2015 15:00:00 +0800",Loving The Borg: Transhumanism in the Real World.,"JP Review, Sci-Fi, Science and Tech","Keith Stevenson, Keith Stevenson",North Ballroom (Large ballroom),"Humanity’s ultimate merging with the machine is a dream – or nightmare – depending on which Hollywood trope you subscribe to, but what would it really be like and how would it happen? Would a transhuman feel less human or more, and would they be the best judge of the change? Could they still love, hope, create if their conscious thoughts were reduced to a stream of ones and zeroes? Would they still feel tethered in the real world or lost in the infinite possibilities of virtual reality? Our panellists consider the many and varied ways that true transhumanism will change us forever."
12556,"Sun, 05 Apr 2015 20:30:00 +0800","Sun, 05 Apr 2015 21:30:00 +0800",Beyond IO9: Online sources of our fannish hits,Fandom,"Dave Cake, Brendan Ragan",Hamersley South (Small Panel Room),"Alternative sources of SF reviews and culture online, beyond the 900lb Gorilla in the corner"
12563,"Sun, 05 Apr 2015 22:30:00 +0800","Sun, 05 Apr 2015 23:30:00 +0800",YouTube-a-Rama: The strangest fannish stuff we love from YouTube.,"Adult Only, TV, TV","",Hamersley South (Small Panel Room),"Weird and wonderful youtube (Imagine dragons: Radiofire, Queen's I want to break free)"
12564,"Thu, 02 Apr 2015 20:00:00 +0800","Thu, 02 Apr 2015 21:00:00 +0800",Genderbending in Fanworks: Does my genderflip invalidate your slash and other questions?,"Fandom, Transformative Works","Anna Hepworth, Sarah Xu",North Hamersley (Gaming and Others),
12566,"Sun, 05 Apr 2015 11:00:00 +0800","Sun, 05 Apr 2015 12:00:00 +0800",Reading Lite Gaming,"Family, Gaming","",North Hamersley (Gaming and Others),"Games for non-readers - children/esl/reading issues - cards, moncalay checkers, 9 men?s morris, transamerica, Wixrt, start in panel room, move to games room"
12577,"Fri, 03 Apr 2015 20:30:00 +0800","Fri, 03 Apr 2015 21:30:00 +0800",Intersections Between Sex and Technology,"Adult Only, Science and Tech",Sandy Norman,Hamersley South (Small Panel Room),Sex is often assumed to be natural and instinctive but it has always been intricately connected with technology. This presentation will discuss some of these intersections and speculate about where technology might lead us in the future.
12578,"Mon, 06 Apr 2015 14:00:00 +0800","Mon, 06 Apr 2015 15:00:00 +0800",Apocalypse During Swancon - Group Workshop,"Discussion, Fantasy, Sci-Fi, X For Beginners","Chris Coman, Sarah Xu",North Hamersley (Gaming and Others),"The apocalypse happens while we’re at the hotel. We have 350ish attendees of varying ages and skills. How do we survie? How do we run things? greater good or best death? Food, plans, location? (Will need to be fleshed out as the nature of the apocalypse will affect the plans)"
12585,"Fri, 03 Apr 2015 16:00:00 +0800","Fri, 03 Apr 2015 17:00:00 +0800",The End of the Printed Page: Are Books (as we know them) Dead?,Books,"PRK , Amanda Bridgeman, Kylie Chan, Donna Maree Hanson, Louisa Loder, Gillian O'meagher",Centre Ballroom (Med Ballroom),"MODERATOR: PRK
is reading books dead? in the age of TV, movies, youtube and fanfiction, is the publishing industry and high quality fiction dead?"
12587,"Fri, 03 Apr 2015 19:30:00 +0800","Fri, 03 Apr 2015 20:30:00 +0800",Ch.ch.ch.changes: SF&F as a transformative force upon Society,"Fandom, Literature","Louisa Loder, Cat Sparks, Keith Stevenson",Centre Ballroom (Med Ballroom),“There is no place like home” Scifi takes us away from home. How has our world changed as a result of SF?
12588,"Fri, 03 Apr 2015 10:00:00 +0800","Fri, 03 Apr 2015 11:00:00 +0800",Gods and Monsters: Doctor Who's 13th Season,Sci-Fi,"Aaron Creaser, Damian Magee, Heather Magee, Danny Oz, Colin Sharpe, Grant Watson",North Ballroom (Large ballroom),"In 1975 Doctor Who returned to the BBC for its 13th series. It saw Tom Baker firmly establish himself as the most popular Doctor the series had ever had, and secure his Doctor's partnership with Sarah-Jane Smith (Elizabeth Sladen) in the minds of viewers forever. Over the course of six serials, viewers saw the Doctor and Sarah fight the Loch Ness Monster, travel to the edge of the universe, battle an Egyptian God, encounter robot duplicates, challenge an enemy from Time Lord history and struggle the save the Earth from an enormous plant. Join us as we celebrate one of Doctor Who's most popular and memorable seasons of all time."
12589,"Thu, 02 Apr 2015 20:00:00 +0800","Thu, 02 Apr 2015 21:00:00 +0800",9th Year of the Video Quiz: Swancon Birthday Edition,"Film, TV","Damian Magee, Heather Magee",Centre Ballroom (Med Ballroom),"In its 9th year come join in the fun, with clips from Film, TV, and Music of the 1970’s"
12590,"Sat, 04 Apr 2015 17:00:00 +0800","Sat, 04 Apr 2015 18:00:00 +0800",New Who: The Capaldi Continuum,"Sci-Fi, TV","Michael Cogan, Aaron Creaser, Damian Magee, Heather Magee",Hamersley South (Small Panel Room),"This panel take look Peter Capaldi first season of the Doctor, did the some of the stories work or others did not. How did people felt when the late Brigadier turn into a Cyberman, what of The Master now The Mistress came join us express your views?"
12591,"Thu, 02 Apr 2015 19:00:00 +0800","Thu, 02 Apr 2015 20:00:00 +0800",Hanna-Barbera Part 2,TV,Damian Magee,Centre Ballroom (Med Ballroom),"(1970-79)-the Seventies for the company has lot more misses than hits and few classics that we can remember, why did some of series fail.  From Harlem Globetrotters, Josie and Pussycats to Valley of the Dinosaurs some of highlights"
